{
  "schema_version": 1,
  "context_kind": "intake",
  "name": "OpenRoot Thermal Cascade L0 intake",
  "description": "Early design-packet intake for a thermal cascade concept. This context represents an unvalidated hypothesis and documentation workflow only. It does not authorize construction, physical testing, performance claims, safety claims, or evidence-level promotion.",
  "evidence_level": 0,
  "risk_level": 2,
  "uncertainty": 0.95,
  "missing_measurements": true,
  "system_map_exists": false,
  "feedback_exists": false,
  "metric_out_of_bounds": false,
  "stop_conditions_defined": false,
  "surplus_flow": 0.0,
  "storage_capacity": 0.0,
  "expected_yield": 0.0,
  "minimum_yield": 1.0,
  "renewable_option_viable": false,
  "lifecycle_benefit": 0.0,
  "waste_stream_detected": false,
  "reuse_path_exists": false,
  "compatible_nodes": 0,
  "connection_value": 0.0,
  "connection_cost": 1.0,
  "intervention_scale": 0,
  "reversibility": 1.0,
  "concentration_risk": 0.0,
  "edge_opportunity_score": 0.0,
  "change_detected": false,
  "adaptation_option_exists": false,
  "safety_review_complete": false,
  "claimed_outputs": [],
  "evidence_artifacts": [],
  "tags": [
    "openroot",
    "thermal-cascade",
    "design-intake",
    "L0",
    "human-review-required"
  ]
}
