{
  "adaptation_option_exists": false,
  "change_detected": false,
  "claimed_outputs": [],
  "compatible_nodes": 2,
  "concentration_risk": 0.4,
  "connection_cost": 0.3,
  "connection_value": 0.7,
  "context_kind": "intake",
  "description": "Initial L0/L1 intake context. It records a hypothesis and routing state only. It is not a physical test plan, performance claim, prototype certification, or physical-system validation record.",
  "edge_opportunity_score": 0.8,
  "evidence_artifacts": [],
  "evidence_level": 1,
  "expected_yield": 0.0,
  "feedback_exists": false,
  "intervention_scale": 2,
  "lifecycle_benefit": 0.4,
  "metric_out_of_bounds": false,
  "minimum_yield": 1.0,
  "missing_measurements": true,
  "name": "OpenRoot Thermal Cascade L0/L1 intake",
  "renewable_option_viable": true,
  "reuse_path_exists": true,
  "reversibility": 0.8,
  "risk_level": 2,
  "safety_review_complete": false,
  "schema_version": 1,
  "stop_conditions_defined": false,
  "storage_capacity": 0.5,
  "surplus_flow": 1.0,
  "system_map_exists": false,
  "tags": [
    "thermal",
    "design-packet",
    "L0",
    "L1",
    "human-review-required"
  ],
  "uncertainty": 0.9,
  "waste_stream_detected": true
}
